검색 키워드,제목,원본 링크,네이버 뉴스 링크,요약,게시 날짜
반도체,"조인철 의원, 'AI혁신거점 글로벌 경쟁력 확보' 정책토론회 개최",http://www.jeollailbo.com/news/articleView.html?idxno=759696,http://www.jeollailbo.com/news/articleView.html?idxno=759696,"조 의원은 이어 &quot;대한민국 차원에서도 우리가 전통적으로 강세를 보이던 메모리<b>반도체</b> 산업이 유례없는 침체기를 겪는 상황이기에 신산업 전환과 새로운 성장동력 확보, 미래 먹거리 선점은 무엇보다 절박한 과제&quot;라며... ","Thu, 20 Feb 2025 12:10:00 +0900"
반도체,여야정 첫 국정협의회…추경·<b>반도체</b>법·연금 '담판' 지을까,https://daily.hankooki.com/news/articleView.html?idxno=1181922,https://daily.hankooki.com/news/articleView.html?idxno=1181922,"장기간 대치를 이어 온 추가경정예산안(추경)부터 연금개혁, <b>반도체</b>특별법이 테이블에 오를 전망이지만... 내수 부진의 직격탄을 맞은 자영업자·소상공인들을 위한 조치와 <b>반도체</b>, 인공지능(AI), 원전 등 미래 산업을 위한... ","Thu, 20 Feb 2025 12:10:00 +0900"
반도체,"MS, 첫 위상 양자컴 칩 '마요라나1' 공개…일부 물리학자들 회의적",https://www.dongascience.com/news/view/70149,https://n.news.naver.com/mnews/article/584/0000031011?sid=105,MS 연구팀은 <b>반도체</b>인 인듐비소(InAs)와 알루미늄을 결합해 만든 시스템으로 '위상 초전도체'를 구현했다고 밝혔다. 위상 초전도체는 안정적으로 초전도성을 띠는 물질로 양자 정보의 손상을 막고 오류를 제어할 수... ,"Thu, 20 Feb 2025 12:09:00 +0900"
반도체,'AI 국가대표' 정예팀 선발해 글로벌 톱 수준 LLM 개발한다,https://www.busan.com/view/busan/view.php?code=2025022011400513867,https://n.news.naver.com/mnews/article/082/0001312640?sid=101,"또한 2030년까지 국가 AI컴퓨팅 센터 내 국산 AI <b>반도체</b> 비중을 50%로 끌어올리는 등 저전력·고성능의 국산 AI <b>반도체</b> 경쟁력을 높인다. 세제지원, 전력·입지 등 제도적 기반도 강화한다. AI를 조세특례제한법상... ","Thu, 20 Feb 2025 12:08:00 +0900"
반도체,박성택 산업차관 &quot;美 관세조치 맞춰 업종별 추가대책 마련&quot;,https://www.newsworks.co.kr/news/articleView.html?idxno=785328,https://www.newsworks.co.kr/news/articleView.html?idxno=785328,"불필요하다&quot;면서도 &quot;<b>반도체</b>와 비<b>반도체</b> 품목 간 괴리가 지속되고 있고, 트럼프 2기 정부가 출범하면서 글로벌 무역분쟁 심화 우려도 상존해 2025년 한국 수출 경기 회복에 대한 기대감을 가지기 어려울 수 있다&quot;고... ","Thu, 20 Feb 2025 12:08:00 +0900"
스마트폰,시민 의견 반영한다…용산공원 시만참여 프로그램 ‘온라인 투표’ 실시,http://www.lak.co.kr/news/boardview.php?id=19442,http://www.lak.co.kr/news/boardview.php?id=19442,누구나 참여할 수 있으며 PC나 <b>스마트폰</b>으로 접속해 선호하는 항목에 투표하면 된다. 투표결과는 2025년 용산공원 활성화 및 시민소통 프로그램에 반영된다. 프로그램 운영은 신용산역 인근 ‘용산도시기억전시관’이... ,"Thu, 20 Feb 2025 12:10:00 +0900"
스마트폰,중국업체 턱밑 추격하는데 ‘갓성비’ 아이폰까지...삼성 비상,https://www.dailian.co.kr/news/view/1464141/?sc=Naver,https://n.news.naver.com/mnews/article/119/0002925442?sid=105,"전 세계 <b>스마트폰</b> 시장에서의 삼성전자 입지가 위태롭다. 최근 인도, 동남아시아 등 주요 신흥 시장에서... 애플은 19일(현지시간) 새로운 보급형 <b>스마트폰</b> ‘아이폰 16E’를 처음 공개했다. 애플의 보급형폰 출시는 약... ","Thu, 20 Feb 2025 12:10:00 +0900"
스마트폰,노스텔지어 캐리어 캐시워크 퀴즈 이벤트 진행,https://www.rapportian.com/news/articleView.html?idxno=217793,https://www.rapportian.com/news/articleView.html?idxno=217793,"퀴즈 참여는 캐시워크 앱을 통해 할 수 있다. 캐시워크 앱은 <b>스마트폰</b>을 켤때마다 만보기를 통해 소비 칼로리, 움직인 거리와 시간까지 계산해주는 만보기형 잠금화면 어플이다.","Thu, 20 Feb 2025 12:10:00 +0900"
스마트폰,"정선 여량농협, 지역 조합원 대상 디지털 금융교육 실시 호평",https://www.jeonmae.co.kr/news/articleView.html?idxno=1121060,https://www.jeonmae.co.kr/news/articleView.html?idxno=1121060,마을별로 좌담회와 <b>스마트폰</b> 활용 교육은 26일까지 병행된다. 특히 <b>스마트폰</b>을 통한 금융 앱 활용과 전자금융사기 예방법 교육은 농업인 등 지역주민들에게 큰 호응을 얻었다. 주재경 조합장은 &quot;농협은 농업·농촌의 대표... ,"Thu, 20 Feb 2025 12:10:00 +0900"
스마트폰,"애플 보급형 모델 아이폰16e 출시, 삼성 갤럭시A 시리즈와 대결 한다",http://www.fnnews.com/news/202502201152074412,https://n.news.naver.com/mnews/article/014/0005311113?sid=105,"삼성전자는 지난해 갤럭시 A15, A25, A35, A55과 AI를 탑재한 보급형 <b>스마트폰</b> '갤럭시 S24 팬에디션(FE)'을 출시해 판매중이다. 또 삼성전자는 보급형 <b>스마트폰</b> 갤럭시 A 시리즈와 갤럭시 탭 S9 FE 시리즈에서도 A) 검색... ","Thu, 20 Feb 2025 12:07:00 +0900"
반도체,'작심발언' 한경협 회장 &quot;韓 경제는 벼랑 끝…엔비디아 시총 삼성전자의...,https://www.dailian.co.kr/news/view/1464147/?sc=Naver,https://n.news.naver.com/mnews/article/119/0002925446?sid=101,<b>반도체</b> 생산라인의 증설허가를 받는 데만 2~3년이 걸린다. 제도의 경쟁력이 곧 국가경쟁력인 시대에 우리 기업환경은 비교할 수 없을 만큼 열악하다&quot;고 꼬집었다. 1997년 IMF 위기를 극복할 때만 해도 기초체력이... ,"Thu, 20 Feb 2025 12:29:00 +0900"
반도체,한화세미텍 HBM 제조 핵심 장비 첫 선,https://m.skyedaily.com/news_view.html?ID=263826,https://m.skyedaily.com/news_view.html?ID=263826,한화세미텍 사명을 바꾸며 새출발을 시작한 한화세미텍(舊 한화정밀기계)이 국내 최대 규모의 <b>반도체</b>... 돌며 <b>반도체</b> 시장 상황과 기술 현황을 꼼꼼히 살핀 것으로 전해졌다. 세미콘코리아2025는... ,"Thu, 20 Feb 2025 12:28:00 +0900"
반도체,"권영세 &quot;민주당, '민노총 국회지부'로 간판 바꿔 달아야&quot;",https://www.psnews.co.kr/news/articleView.html?idxno=2083159,https://www.psnews.co.kr/news/articleView.html?idxno=2083159,"그는 &quot;<b>반도체</b>특별법에서 주52시간 예외 조항을 넣는 것조차 민주당은 민노총 뜻을 받드느라 대한민국의... 그는 &quot;최근 민주당이 언론에 소개하는 <b>반도체</b>특별법, 상속세 인하, 연금개혁 등은 모두 국민의힘이... ","Thu, 20 Feb 2025 12:26:00 +0900"
반도체,관세 여파 아이폰까지?…&quot;가격 9% 올려야&quot;,http://www.wowtv.co.kr/NewsCenter/News/Read?articleId=A202502200404&t=NN,https://n.news.naver.com/mnews/article/215/0001199210?sid=101,"<b>반도체</b>·자동차에도 25% 수준의 관세를 부과하겠다는 입장이며 무역 상대국들에 대한 '상호 관세'도 예고한 상태다. 애플은 중국에 생산기지를 두고 있으며, 상호 관세의 영향도 받을 것으로 예상된다. 모한... ","Thu, 20 Feb 2025 12:25:00 +0900"
반도체,&quot;52시간 화이팅!&quot; 권성동 외치자…국민의힘·<b>반도체</b> 업계 &quot;으응?&quot; 순간 당...,https://www.newsis.com/view/NISX20250220_0003072335,https://n.news.naver.com/mnews/article/003/0013078628?sid=102,"국민의힘이 친(親) <b>반도체</b> 여론전에 나선 가운데, 권성동 국민의힘 원내대표가 '주 52시간 근로제' 예외 규정을 언급하는 과정에서 혼선을 빚어 눈길을 끌었다. 19일 국민의힘은 경기 성남에 있는 차량용 <b>반도체</b> 기업... ","Thu, 20 Feb 2025 12:25:00 +0900"
스마트폰,상반기 지속될 애플의 '슈퍼사이클'...국내 벤더 영향은?,http://www.biztribune.co.kr/news/articleView.html?idxno=329957,http://www.biztribune.co.kr/news/articleView.html?idxno=329957,"해당 기술은 5GB 미만의 DRAM만으로도 구동 가능해 <b>스마트폰</b>, PC 등 다양한 기기에 적용될 수 있으며, 이는 곧 애플의 AI 전략과 연결된다는 점에서 시장의 관심을 모았다. 실제로 중국에서 iPhone 판매가... ","Thu, 20 Feb 2025 12:28:00 +0900"
스마트폰,"국제자격검정원, 반려동물 관심자를 위한 펫시터 자격증 무료 강의 이벤...",https://www.woodkorea.co.kr/news/articleView.html?idxno=83810,https://www.woodkorea.co.kr/news/articleView.html?idxno=83810,"무료 강의 수강 방법은 교육원 홈페이지 회원 가입 후 원하는 과정을 신청하면 최대 3과정에 대한 교육비 전액을 면제받을 수 있으며, PC와 <b>스마트폰</b>만 있다면 언제 어디서든 강의 수강과 시험 응시가 가능한 100% 온라인... ","Thu, 20 Feb 2025 12:22:00 +0900"
스마트폰,"삼성, 9년만에 임원 2000명 소집 세미나…'위기 돌파' 취지",http://www.whitepaper.co.kr/news/articleView.html?idxno=243371,http://www.whitepaper.co.kr/news/articleView.html?idxno=243371,또한 TV와 <b>스마트폰</b> 시장에서도 점유율이 줄어드는 등 내외적으로 위기를 맞고 있다. 이재용 삼성전자 회장은 2022년 사내 게시판에 취임사를 정리해 올린 '미래를 위한 도전'이라는 글에서 &quot;꿈과 상상을 현실로 만드는... ,"Thu, 20 Feb 2025 12:20:00 +0900"
스마트폰,"한국이러닝인재개발원, 한국소비자만족지수 1위 7년 연속 수상",https://www.job-post.co.kr/news/articleView.html?idxno=128270,https://www.job-post.co.kr/news/articleView.html?idxno=128270,"아울러 직장 내 성희롱 예방교육, 개인정보보호법 교육, 직장 내 장애인 인식 개선교육 등 다양한 법정 의무 교육을 PC와 <b>스마트폰</b>을 통해 수강할 수 있으며 교육 진도율을 완료한 후 수료증을 즉시 발급받을 수 있어... ","Thu, 20 Feb 2025 12:16:00 +0900"
스마트폰,시민 의견 반영한다…용산공원 시만참여 프로그램 ‘온라인 투표’ 실시,http://www.lak.co.kr/news/boardview.php?id=19442,http://www.lak.co.kr/news/boardview.php?id=19442,누구나 참여할 수 있으며 PC나 <b>스마트폰</b>으로 접속해 선호하는 항목에 투표하면 된다. 투표결과는 2025년 용산공원 활성화 및 시민소통 프로그램에 반영된다. 프로그램 운영은 신용산역 인근 ‘용산도시기억전시관’이... ,"Thu, 20 Feb 2025 12:10:00 +0900"
