keyword,date,title,summary,url
삼성전자,2025-02-20,음주운전 실형에 표창장? 코레일에선 가능합니다,"<b>삼성전자</b>의 지난해 '일반 직원' 평균 연봉이 1억 2800만원 안팎이라는 분석 결과가 나왔습니다. 기업분석전문 한국CXO연구소가 <b>삼성전자</b> 감사보고서를 토대로 분석한 결과를 보면, <b>삼성전자</b>의 2024년도 직원보수 총액은... ",https://n.news.naver.com/mnews/article/047/0002463340?sid=101
sk하이닉스,2025-02-20,"충북 청주시, 지난해 6조1천억 투자유치 달성","주요 유치 기업으로 <b>SK하이닉스</b> M15X D램 생산기지 증설(5조원), 이녹스첨단소재 신규 투자(4천400억원), HD현대일렉트릭 투자(1천173억원) 등 첨단 산업 분야 국내 주요 대기업·중견기업이다. 시는 올해에는 기존 반도체... ",https://www.ccdn.co.kr/news/articleView.html?idxno=1012271
반도체,2025-02-20,여야정 대표 추경 공감대…실무협의에서 시기·규모 논의(종합),조 수석대변인은 또 &quot;민생 법안의 신속한 처리를 추경과 함께 실무 협의에서 논의하기로 했다&quot;며 &quot;<b>반도체</b>특... <b>반도체</b>특별법 논의에서는 주 52시간 근로 규제 예외에 대한 입장차가 좁혀지지 못했다. 신 수석대변인은... ,https://news.einfomax.co.kr/news/articleView.html?idxno=4344087
반도체,2025-02-20,"국정협의회 첫 회의, 2시간 열띤 토론 끝 추경 원론적 필요성만 공감",엇갈리는 <b>반도체</b>산업지원특별법도 추후 실무협의에서 논의하기로 했다. 다만 이견이 좁혀지지 않아 실무협의에서도 합의에 이를지는 미지수다. 신 수석대변인은 “최 대행이 52시간 예외 조항을 빼고 처리하면 <b>반도체</b>특... ,https://n.news.naver.com/mnews/article/028/0002732203?sid=100
반도체,2025-02-20,여야정 4자회담 ‘빈손’…추경·<b>반도체</b>법·연금 합의 없어,20 /연합뉴스 여·야·정 대표가 20일 국정협의회 ‘4자 회담’을 열었지만 추가경정예산(추경)과 <b>반도체</b>특별... <b>반도체</b>법과 연금개혁도 실무협의에서 추가 논의하기로 했다. 박태서 국회 공보수석은 의장실 앞에서... ,https://www.kyeongin.com/article/1730107
반도체,2025-02-20,여야정 수장들 머리 맞댔지만...'52시간 예외' <b>반도체</b>법 실타래 못 풀어,여야정이 머리를 맞댔지만 <b>반도체</b> 산업 지원의 내용을 골자로 한 '<b>반도체</b>특별법'의 2월 중 국회 처리 합의에 결국 도달하지 못했다. 고소득 <b>반도체</b> 연구개발(R&amp;D) 인력에 한해 '주 52시간 근무제' 적용의 예외로 해주는... ,https://n.news.naver.com/mnews/article/008/0005156240?sid=100
반도체,2025-02-20,"민주당 “국정협의회, 추경 원칙 합의 성과…2차 회동 조율”","■ <b>반도체</b> 특별법·국민연금 개혁 ‘이견 여전’…추후 실무 논의 합의 조 수석대변인은 논의 안건으로 오른 ‘<b>반도체</b> 특별법’과 ‘연금 개혁’과 관련해서는 여야 간 이견이 좁혀지지 않았다며, 추후 더 논의하기로... ",https://n.news.naver.com/mnews/article/056/0011897109?sid=100
삼성전자,2025-02-20,"[탑픽전쟁] CJ ENM vs 필옵틱스, 승리 전략은?","강화- <b>삼성전자</b> 유리기판 사업과 시너지 효과 기대- 목표가 53,000원 / 손절가 39,000원▶▶▶ 3라운드김오주 3라운드 배틀 종목키다리스튜디오- 지난해 영업이익 22억… '흑자 전환' 성공- 온· 오프라인 굿즈 매출... ",https://news.mtn.co.kr/news-detail/2025022019163973492
삼성전자,2025-02-20,에스엠 주가 폭등랠리... 하츠투하츠 데뷔 벌써 화제,HD현대인프라코어 한전KPS 솔브레인 해성디에스 LIG넥스원 한국항공우주 하나머티리얼즈 HPSP 메가스터디교육 팬오션 엘앤씨바이오 쿠쿠홈시스 원익QnC 에스에프에이 나노신소재 <b>삼성전자</b> S-Oil 다우데이타 피에스케이... ,https://www.pinpointnews.co.kr/news/articleView.html?idxno=322648
sk하이닉스,2025-02-20,트럼프발 '관세폭탄' … 충북기업 리스크 대응 TF 가동,<b>SK하이닉스</b>의 경우 지난해 고대역폭메모리(HBM) 호황으로 창사이래 최대 실적을 기록했지만 트럼프 관세정책이 미칠 영향에 촉각을 세우고 있다. 당분간 <b>SK하이닉스</b>가 HBM를 주도할 것으로 예상되는 가운데 회사는... ,http://www.cctimes.kr/news/articleView.html?idxno=832333
sk하이닉스,2025-02-20,"이준석 “반도체 산업, 통상 압박 심화...정치권의 적극적 역할 필요”","대책 마련해야” 차기 대선 출마를 선언한 이준석(개혁·화성을) 의원은 20일 오전 <b>SK하이닉스</b> 이천공장을 방문해 김정일 대외협력총괄 부사장 등 주요 관계자들과 간담회를 갖고, 반도체 산업의 경쟁력 강화 및 정부 협력... ",https://www.kgnews.co.kr/news/article.html?no=831781
반도체,2025-02-20,"[기획] 트럼프 관세 압박, 요동치는 韓 산업","ⓒ트럼프 SNS 트럼프 미국 대통령이 자동차, <b>반도체</b>, 의약품 등에 대한 고율 관세 부과를 예고하면서 한국... 자동차, <b>반도체</b>, 의약품 등에 대한 관세 부과 시기를 앞당길 가능성을 시사했다. 당초 4월 초 발표가 예상됐던... ",http://www.sisafocus.co.kr/news/articleView.html?idxno=333856
반도체,2025-02-20,"첫 4자회담 '빈손'..추경, <b>반도체</b>법 등 합의도출 실패","추가경정예산(추경)과 <b>반도체</b>특별법의 주52시간 근로 특례 등 쟁점 현안에서 여야는 합의점을 찾지 못했다.... 연금특위와 연금개혁, <b>반도체</b>법 등은 추후 실무협의에서 추가 논의하기로 했다는 것이 박 수석의 전언이다.... ",https://www.straightnews.co.kr/news/articleView.html?idxno=264723
반도체,2025-02-20,국정협의회 4자 회담 결국 '빈손'…추경·<b>반도체</b>법·연금 결론 못 내,20일 여야정 국정협의회 '4자 회담'이 열렸지만 추가경정예산(추경)과 <b>반도체</b>특별법상 '주52시간 근로 특례... <b>반도체</b>법과 연금개혁도 실무협의에서 추가 논의하기로 했다. 박태서 국회 공보수석은 &quot;추경의 필요성에... ,https://n.news.naver.com/mnews/article/082/0001312778?sid=100
반도체,2025-02-20,정치 상황 안정 기대감에 소비자심리지수 소폭 개선,"이는 미국 도널드 트럼프 정부의 자동차, <b>반도체</b> 관세 부과 등 보호무역주의 강화에 따른 수출 둔화 우려 등 악재에도 불구하고 국내 정치적 상황 안정에 대한 기대감 등이 지수에 반영된 결과로 분석된다.... ",https://www.ulsanpress.net/news/articleView.html?idxno=545414
반도체,2025-02-20,"&quot;국힘이 범죄 집단?…李, 존재 자체가 형법교과서&quot;","또 &quot;민주당이 언론에 소개하는 <b>반도체</b>특별법, 상속세 인하, 연금개혁 등은 모두 국민의힘이 보수 정당으로... 권 원내대표는 &quot;민주당은 <b>반도체</b>특별법에서 주 52시간 근로 예외 조항을, 상속세에서 세율 조정을... ",https://www.ulsanpress.net/news/articleView.html?idxno=545359
삼성전자,2025-02-20,"中 로보락, ‘보안·AS’ 약점 잡고 韓 시장 ‘팔방미인’ 거듭날까 [이...","글로벌 가전 양대산맥인 <b>삼성전자</b>와 LG전자가 버티는 한국에서 전국적인 AS망을 갖추지 못하면 고객 서비스에서 밀릴 수밖에 없다. 로보락은 국내에 총 22곳의 AS 센터를 운영 중이고, 전국 315개 롯데하이마트 매장에서... ",https://n.news.naver.com/mnews/article/022/0004012815?sid=101
삼성전자,2025-02-20,"LG‧<b>삼성</b>, 글로벌 가전 시장 '럭셔리 빌트인'으로 공략","◆<b>삼성전자</b>, 럭셔리 빌트인으로 B2B 넘어 B2C, 글로벌 공략 <b>삼성전자</b>도 럭셔리 빌트인 가전 브랜드 '데이코(Dacor)'를 통해 프리미엄 가전 시장을 공략하고 있다. 데이코는 1948년 미국 캘리포니아에서 시작되어... ",http://www.womentimes.co.kr/news/articleView.html?idxno=84965
삼성전자,2025-02-20,"<b>삼성</b> 평택공장 방문한 ASML 전 CEO, &quot;이재용과는 좋은 친구&quot;",이재용 <b>삼성전자</b> 회장과 ASML 전 CEO  ASML의 전 최고경영자(CEO) 피터 베닝크가 네덜란드 경제부 장관 디르크 벨야르츠와 함께 <b>삼성전자</b> 평택 반도체 공장을 방문했다. 이번 방문은 <b>삼성전자</b>와의 오랜 협력 관계를 더욱... ,https://www.cbci.co.kr/news/articleView.html?idxno=486207
sk하이닉스,2025-02-20,청주대·<b>SK하이닉스</b>·청주시 전시회 열어,"CACA는 청주대학교, <b>SK하이닉스</b>, 청주시가 협력해 운영하는 문화예술육성지원 사업이다. 이번 전시회는 지난해 CACA에 참여한 청소년 창작 결과물을 선보이는 자리이다. CACA는 여름방학(키움예술캠프)과 겨울방학... ",http://www.enewstoday.co.kr/news/articleView.html?idxno=2240141
sk하이닉스,2025-02-20,[마감] 한한령 해제 기대 엔터·화장품·여행주 등 동반 강세...모티브링...,"시가총액 상위주는 삼성전자(-0.51%), <b>SK하이닉스</b>(-2.97%), 삼성바이오로직스(-0.61%), 현대차(-0.49%), 셀트리온(-0.11%), 기아(-0.53%), NAVER(-0.23%) 등이 하락했다. LG에너지솔루션(2.87%), KB금융(0.61... ",https://www.asiatime.co.kr/article/20250220500446
sk하이닉스,2025-02-20,"이준석, <b>SK하이닉스</b> 방문…&quot;반도체산업 인프라 투자해야&quot;",개혁신당 이준석 의원은 20일 <b>SK하이닉스</b> 관계자들을 만나 반도체 산업 경쟁력 강화를 위한 정책 개발을 약속했다. 이 의원은 이날 오전 개혁신당 지도부와 <b>SK하이닉스</b> 이천 공장을 방문해 김정일 부사장 등과 면담했다. 이... ,https://n.news.naver.com/mnews/article/003/0013079953?sid=100
sk하이닉스,2025-02-20,청주대·<b>SK하이닉스</b>·청주시 청소년 융합 전시회 개최,"CACA는 청주대, <b>SK하이닉스</b>, 청주시가 협력해 운영하는 문화예술육성지원사업이다. 이번 전시회는 지난해 CACA에 참여한 청소년 창작 결과물을 선보이는 자리이다. 전시회에서는 '나를 찾는 여행', '우리를 찾는 여행... ",http://www.cctimes.kr/news/articleView.html?idxno=832340
반도체,2025-02-20,"여야정, 첫 국정협의회서 '추경 필요성' 공감… <b>반도체</b>특별법은 추가 논...",관심을 모았던 추가경정예산(추경)과 <b>반도체</b> 특별법 등은 합의에 실패했다. 다만 추경 필요성에는 공감대를... 관심을 모았던 추가경정예산(추경)과 <b>반도체</b> 특별법 등은 합의에 실패했다. 다만 추경 필요성에는 공감대를... ,http://www.metroseoul.co.kr/article/20250220500766
반도체,2025-02-20,이준석 “<b>반도체</b> 국제 통상 압박 심화… 정치권 나서야”,관계자들과 <b>반도체</b> 산업에 대한 정부 협력 방안을 논의했다. /이준석 의원실 제공 개혁신당 이준석(화성을) 의원이 20일 SK하이닉스 이천공장을 방문해 주요 관계자들과 <b>반도체</b> 산업의 경쟁력 강화를 논의하는 자리에서... ,https://www.kyeongin.com/article/1730131
반도체,2025-02-20,"첫 국정협의회, 추경엔 공감…연금·<b>반도체</b>특별법 합의 불발","<b>반도체</b>특별법과 추가경정예산안(추경), 연금개혁 등 현안에 합의하지 못했다. 민생 회복을 위한 추경 편성이 필요하다는 큰 틀에서만 공감대를 이루고 구체적 내용은 추후 실무회의에서 논의하기로 한 것이다. <b>반도체</b>특... ",https://n.news.naver.com/mnews/article/020/0003616687?sid=100
반도체,2025-02-20,"여야정, 추경 편성 실무협의 진행…<b>반도체</b>법·연금개혁 평행선(종합)",<b>반도체</b>특별법과 연금개혁도 합의안을 도출하는 데 실패했다. 최상목 대통령 권한대행과 우원식 국회의장... 여야정은 <b>반도체</b>특별법 연구개발(R&amp;D) 인력에 대한 '주 52시간 근로제' 예외 적용과 관련해서도 이견을 좁히지... ,https://n.news.naver.com/mnews/article/421/0008089050?sid=100
반도체,2025-02-20,"[이슈추적] ‘<b>반도체</b> 벨트’ 지역구 의원들, 더 빨리 특별법 제정 ‘공...","2025.2.19 /이지훈기자 jhlee@kyeongin.com <b>반도체</b> 연구·개발 분야에 주52시간 근로제 규제 특례를 적용하는 문제와 관련, 여야간 이견으로 <b>반도체</b> 특별법 제정이 속도를 내지 못하는 가운데 삼성전자·SK하이닉스 주요 사업장과... ",https://www.kyeongin.com/article/1730126
반도체,2025-02-20,한화세미텍 사명변경 후 첫 공식 행사에 김동선 부사장 방문,최근 새로운 사명을 발표한 한화세미텍(Hanwha Semitech)이 국내 최대 규모의 <b>반도체</b> 박람회인... [사진] 김동선 미래비전총괄 부사장이 부스 곳곳을 돌며 기술 현황을 점검하고 있다 세미콘은 국제<b>반도체</b>장비재료협회... ,https://wemakenews.co.kr/news/view.php?no=21037
반도체,2025-02-20,"여야정, 첫 국정협의회서 추경 필요성만 공감…주52시간은 이견",<b>반도체</b>특별법 '주52시간제' 예외 문제도 이견을 좁히지 못했다. 이를 두고 사실상 빈손 회담이었다는 평가도... 또다른 주요 쟁점이었던 <b>반도체</b>특별법 '주52시간제' 예외 조항과 관련해서도 여야정은 이견을 좁히지 못하고... ,https://n.news.naver.com/mnews/article/629/0000366594?sid=100
반도체,2025-02-20,국정협의회 첫 회의 사실상 '빈손'…실무협의 계속[종합],"여·야·정이 20일 <b>반도체</b>특별법, 연금개혁, 추가경정예산안(추경) 편성 등 주요 쟁점 현안에 대해 구체적... 신동욱 수석대변인은 &quot;우리는 52시간 예외 규정이 <b>반도체</b>법의 핵심이라고 거듭 얘기했다&quot;며 &quot;민주당은 그 부분이... ",https://n.news.naver.com/mnews/article/031/0000910558?sid=100
반도체,2025-02-20,"여야정, <b>반도체</b>법·연금개혁·추경 합의 불발",여야정은 △추가경정예산 편성 △<b>반도체</b>특별법 △연금개혁 △국방부 장관 임명 등을 놓고 1시간56분 동안... 최 권한대행이 &quot;현재 근로시간 제도로는 집중 근무가 어려워 연구 단절이 발생한다&quot;며 <b>반도체</b>법 처리를... ,https://n.news.naver.com/mnews/article/009/0005447354?sid=100
반도체,2025-02-20,여야정 4자회담 '빈손종료'…추경·<b>반도체</b>법·연금 합의 불발(종합),"재확인…<b>반도체</b>법·연금 실무협의 이어가기로 국회 윤리·APEC특위 구성엔 합의…민생 법안도 실무 협의키로... (추경)과 <b>반도체</b>특별법의 '주52시간 근로 특례', 연금개혁 등 쟁점 현안에서 구체적인 합의점을 도출하지... ",https://n.news.naver.com/mnews/article/001/0015225528?sid=100
삼성전자,2025-02-20,"이상일 용인특례시장, 미국 텍사스주 윌리엄슨 카운티 대표단과 'SEMICON...","또한, &quot;지난 1월 9일 윌리엄슨 카운티에서 '용인시의 날'을 기념해 세운 '용인대로' 표지판에 감동받았다&quot;며, &quot;윌리엄슨 카운티의 환대에 보답하고자 기흥구 <b>삼성전자</b> 기흥캠퍼스 앞에 '윌리엄슨 카운티 대로' 표지판을... ",http://www.hansbiz.co.kr/news/articleView.html?idxno=735287
삼성전자,2025-02-20,"옆집 사는 <b>삼성</b>맨 연봉, 이 정도라고?...“지난해 평균 1억2800만원”",<b>삼성전자</b>의 지난해 직원 연간 평균 연봉이 1억2800만원 수준이라는 분석이 나왔다. 아울러 1만명 이상의 신규 직원을 채용한 <b>삼성전자</b>지만 퇴사자 역시 6500명 수준으로 매년 증가 추세인 것으로 나타났다.... ,https://n.news.naver.com/mnews/article/009/0005447348?sid=101
삼성전자,2025-02-20,[이슈추적] 갈 길 먼 반도체 ‘주 52시간’에 멈췄다,사진은 20일 평택시 고덕동 <b>삼성전자</b> 평택캠퍼스에서 반도체 불황으로 P4 공장 등 공사가 일부 중단된 모습. 2025.2.20 /이지훈기자 jhlee@kyeongin.com 세계 반도체 경쟁 심화에 ‘트럼프 쇼크’까지 더해져 경기도 핵심 산업인... ,https://www.kyeongin.com/article/1730113
sk하이닉스,2025-02-20,이준석 “반도체 국제 통상 압박 심화… 정치권 나서야”,"<b>SK하이닉스</b> 이천공장 방문 산업발전 공약 제시방안 검토 밝혀 근로시간 관련 “연봉 기준, 단편적” 개혁신당 이준석(화성을) 의원이 20일 <b>SK하이닉스</b> 이천공장을 방문해 관계자들과 반도체 산업에 대한 정부 협력 방안을... ",https://www.kyeongin.com/article/1730131
sk하이닉스,2025-02-20,"[이슈추적] ‘반도체 벨트’ 지역구 의원들, 더 빨리 특별법 제정 ‘공...","2025.2.19 /이지훈기자 jhlee@kyeongin.com 반도체 연구·개발 분야에 주52시간 근로제 규제 특례를 적용하는 문제와 관련, 여야간 이견으로 반도체 특별법 제정이 속도를 내지 못하는 가운데 삼성전자·<b>SK하이닉스</b> 주요 사업장과... ",https://www.kyeongin.com/article/1730126
sk하이닉스,2025-02-20,[2월21일자] 비즈니스포스트 아침의 주요기사,"삼성전자·<b>SK하이닉스</b> 실적 기대감 ● 유럽연합 ESG 규정 시행 연기와 완화 검토, &quot;기업 경쟁력 약화 우려&quot; ● 마이크로소프트 xAI와 '인공지능 게임 개발' 대결하나, 제작비 절감 기술 공개 ● [단독] '미국사업 손에 쥐다... ",https://www.businesspost.co.kr/BP?command=article_view&num=384365
sk하이닉스,2025-02-20,"[포토]청주시 문화예술융합아카데미, 청소년전시회 '카카이즘' 열어","청주시, 청주대, <b>SK하이닉스</b>가 함께 추진하는 문화예술융합아카데미는 20일 청원구 동부창고에서 청소년융합전시회 'CACA-ISM'(카카이즘)을 개최했다고 밝혔다. 전시회에는 이범석 청주시장, 김윤배 청주대학교 총장... ",http://www.enewstoday.co.kr/news/articleView.html?idxno=2240146
반도체,2025-02-20,"글로벌 경제 불안정 속 엔화와 금시세 상승, 주식 시장 변동성 확대","트럼프의 최근 관세 경고는 의약품, <b>반도체</b> 칩, 목재에 초점을 맞추고 있으며, 4월 2일에는 자동차 수입에 대한 타격도 예고하고 있다. 이러한 무역 전쟁에 대한 우려가 커지면서 투자자들은 불안감을 느끼고 있다.... ",https://www.thefairnews.co.kr/news/articleView.html?idxno=41832
반도체,2025-02-20,국정협의회 '추경·<b>반도체</b>특별법·연금' 합의 불발 (종합),"못했다.<b>반도체</b>특별법은 '주 52시간 적용 제외' 이견차가 컸고, 연금개혁 역시 모수·구조 개혁 분리·일괄... 권 비대위원장은 4자회담 뒤 기자들과 만나 &quot;(추경) 필요성에 대해 계속 논의한다고 돼 있다&quot;면서, <b>반도체</b>특별법... ",https://www.asiatoday.co.kr/view.php?key=20250220010011179
반도체,2025-02-20,<b>반도체</b>법·추경 등 사실상 '빈손',"특히 여야가 강조해 온 <b>반도체</b>특별법 처리와 추가경정예산 등 쟁점에 대한 공감대는 모았지만 구체적... 이외 쟁점 사안이었던 <b>반도체</b>특별법 주52시간제 예외조항 포함 여부, 추경 편성, 연금개혁 등은 추후 실무협상... ",https://n.news.naver.com/mnews/article/014/0005311459?sid=100
반도체,2025-02-20,"스티븐스 前주한美대사 “韓, 우크라처럼 트럼프 ‘패싱’ 우려 높아”","조 바이든 전임 행정부가 시행한 인플레이션감축법(IRA), <b>반도체</b>법 등에 따라 한국 기업이 미국에 대규모 투자를 한 것을 거론하며 “트럼프 2기 행정부가 이들 법안과 기타 법안에서 제시된 몇 가지 이니셔티브를 이행하는... ",https://n.news.naver.com/mnews/article/020/0003616692?sid=104
반도체,2025-02-20,별 소득 없었던 '여야정 4자회담'…추경·<b>반도체</b>법·연금 합의 불발,"또 연금특위와 연금개혁은 실무 협의회에서 추가 논의하기로 했으며, <b>반도체</b>법도 추후 실무 협의에서 다시... <b>반도체</b>특별법의 경우 연구개발(R&amp;D) 인력에 대한 '주 52시간 근로제' 예외 적용이 쟁점이었다. 정부와 여당은... ",https://www.newsworks.co.kr/news/articleView.html?idxno=785420
반도체,2025-02-20,김태흠 지사 &quot;충청권 통합은 충청대망론 다시 세우는 길&quot;,이어 김 지사는 &quot;대전의 R&amp;D·과학기술과 충남의 생산·제조 기능을 연계해 시너지 효과를 창출해 경제발전의 동력으로 삼겠다&quot;며 &quot;특히 충남의 '<b>반도체</b>·모빌리티'와 대전의 '우주·로봇·바이오' 등 첨단산업을 집적화해... ,http://www.ccnnews.co.kr/news/articleView.html?idxno=362957
반도체,2025-02-20,"대구대, 차세대<b>반도체</b> 교육연구센터 개소",대구대는 최근 차세대<b>반도체</b> 교육연구센터를 개소했다. 대구대가 최근 대구 수성알파시티에 <b>반도체</b> 전문 인력 양성을 위한 거점인 차세대<b>반도체</b> 교육연구센터를 개소했다. 대구대 차세대<b>반도체</b>혁신공유대학 사업단 및... ,https://www.idaegu.co.kr/news/articleView.html?idxno=501054
반도체,2025-02-20,"박성택 산업1차관 “미국 관세 조치, 업종별 추가대책 마련”","박 차관은 &quot;2월에도 글로벌 수요 둔화와 <b>반도체</b>, 석유제품 등 주요 수출 품목의 단가 약세가 이어지면서 수출을 둘러싼 대외 여건이 녹록지 않다&quot;고 지적하며 최근 발표된 범정부 비상 수출대책을 속도감 있게 이행하겠다고... ",https://n.news.naver.com/mnews/article/021/0002691684?sid=101
반도체,2025-02-20,"“美, 러와 협상에 우크라 뺀것처럼…北과 대화때 ‘한국패싱’ 우려”","조 바이든 전임 행정부가 시행한 인플레이션감축법(IRA), <b>반도체</b>법 등에 따라 한국 기업이 미국에 대규모 투자를 한 것을 거론하며 “트럼프 2기 행정부가 이들 법안과 기타 법안에서 제시된 몇 가지 이니셔티브를 이행하는... ",https://n.news.naver.com/mnews/article/020/0003616692?sid=104
반도체,2025-02-20,"여야정 4자회담, 공동 합의문도 없이 협의체 종료…제각각 브리핑","'<b>반도체</b> 특별법' 놓고 정부·여당, 야당 간 입장차 확인 연금 개혁 논의서도 접점 찾지 못해 아주경제=나선혜... 공개 발언에서부터 최 권한대행과 이 대표 간 신경전이 벌어졌던 '<b>반도체</b> 특별법'은 정부, 여당과 야당 간... ",https://www.ajunews.com/view/20250220214326503
반도체,2025-02-20,"트럼프, 수입 자동차에 25% 관세 부과 계획 발표","또한, <b>반도체</b>와 자동차 관련 기업들이 곧 미국 투자와 관련된 발표를 할 것이라고 언급했지만, 구체적인 기업 이름은 밝히지 않았다. EU와 관련해서는 &quot;EU는 이미 자동차 관세를 우리와 같은 수준으로 낮췄다&quot;며 &quot;이제... ",https://www.ggilbo.com/news/articleView.html?idxno=1074781
sk하이닉스,2025-02-20,[오늘 2월 20일] 독특한 예술영화 ‘몽유도원’…LG에너지솔루션 연이은...,"종목 별로는 삼성전자(-0.68%), <b>SK하이닉스</b>(-2.75%), HD현대중공업(-10.23%), HD한국조선해양(-8.58%), 현대차(-0.49%), 기아(-0.53%), NAVER(-0.2%)는 하락하며 마감했다. 반면 LG에너지솔루션(+2.87%)는 어제에 이어 상승 마감했다. 특히... ",http://www.kwangju.co.kr/article.php?aid=1740052800780337339
sk하이닉스,2025-02-20,"이준석, <b>SK하이닉스</b> 이천공장 방문…&quot;52시간 예외 적용, 현장 맞춤 솔루...",이 의원과 당 지도부는 이날 경기 이천시 <b>SK하이닉스</b> 이천공장에서 김정일 부사장을 비롯한 주요 관계자들과 간담회를 진행했다. 이들은 이 자리에서 반도체 산업의 경쟁력 강화 및 정부 협력 방안을 논의했다. 이준석... ,https://www.newspim.com/news/view/20250220001054
반도체,2025-02-20,"&quot;AI 기업 해외 시장 지원 절실… 경기, 맞춤형 대책 마련&quot;",최근 과학기술정보통신부의 AI <b>반도체</b> 해외 실증 지원사업과 연계해 국산 AI <b>반도체</b>의 글로벌 시장 진입을 촉진한다. 김기병 AI국장은 &quot;경기도는 AI 혁신을 이끄는 기업들이 지속적으로 성장할 수 있도록 정책적 지원을... ,https://www.newscj.com/news/articleView.html?idxno=3236777
반도체,2025-02-20,3D 이미지 센서 개발…더 선명한 영상 제공,"포스텍 이지원 교수 포스텍은 이지원(사진) <b>반도체</b>공학과·전자전기공학과·<b>반도체</b>대학원 교수팀이 벨기에 <b>반도체</b> 연구기관인 아이맥, 서강대 김성진 교수 연구팀과 차세대 이미징 기술을 선도할 3D 이미지 센서를... ",https://www.idaegu.co.kr/news/articleView.html?idxno=501058
