keyword,date,title,summary,url
반도체,2025-02-20,"[AW 2025 참가기업 인터뷰] 마이크로엡실론코리아, 정밀 센서 기술로 '주...","당사의 제품은 전자, <b>반도체</b>, 디스플레이, 배터리, 항공, 자동차, 조선 산업 등 다양한 분야에서 사용되고... capaNCDT 6200은 다중 채널 정전용량 변위 센서 시스템으로, 컨트롤러 확장이 가능하며, <b>반도체</b> 등의 고전도율... ",https://www.hellot.net/news/article.html?no=98138
반도체,2025-02-20,"원자력연구원, 제10회 사업화 유망 원자력 기술 설명회 개최","지난 2016년에 시작해 매년 꾸준히 열려 10주년을 맞이한 올해 설명회에선 원자력연구원이 보유한 2,000여 개의 특허 중 ▲차세대 원자력 ▲소프트웨어 ▲<b>반도체</b>·디스플레이 ▲부품·소재·재료 ▲로봇·이차전지·모빌리티... ",http://www.epj.co.kr/news/articleView.html?idxno=35818
반도체,2025-02-20,"트럼프 한 마디에 수조원이…완성차 업계, 매일매일이 당혹","도널드 트럼프 미 대통령 (사진=AFP) 트럼프 대통령은 19일(현지시간) 사우디아라비아 국부펀드 주최로 플로리다주 마이애미에서 열린 ‘미래투자이니셔티브’ 연설에서 “자동차, <b>반도체</b>, 의약품, 목재 등에 대한... ",https://n.news.naver.com/mnews/article/018/0005948054?sid=103
삼성전자,2025-02-20,"<b>삼성전자</b>, '비스포크 AI 식기세척기' 신제품 출시",▲ <b>삼성전자</b> 2025년 '비스포크 AI 식기세척기' 신제품. (사진=<b>삼성전자</b> 제공)  <b>삼성전자</b>는 더 똑똑해진 AI 기능과 주방공간에 일체감 있게 녹아드는 미니멀한 디자인을 갖춘 2025년형 '비스포크 AI 식기세척기' 신제품을... ,https://www.siminilbo.co.kr/news/newsview.php?ncode=1160289590219306
삼성전자,2025-02-20,"&quot;개인정보 유출 없다&quot; 中 로보락, 보안 논란 속 신제품 공개…韓 점유율...",현재 로보락은 <b>삼성전자</b>와 LG전자 등 국내 기업을 제치고 시장점유율 1위를 차지하고 있다. 작년 하반기 기준 점유율은 40% 중반대로 전년 대비 10%포인트 이상 증가했다. 지난해 한국 매출도 약 9% 이상 늘었다. 댄 챔... ,http://www.metroseoul.co.kr/article/20250220500614
sk하이닉스,2025-02-20,"코스피, 차익실현 매도세에 2650대로 밀려나...8거래일만 상승세 꺾여","시가 총액 상위 10개 종목 중 LG에너지솔루션(2.87%), KB금융(0.61%), 삼성전자우(0.30%)를 제외한 <b>SK하이닉스</b>(-2.97%), 현대차(-0.61%), 기아(-0.53%), 삼성전자(-0.51%), 현대차(-0.49%), NAVER(-0.23%), 셀트리온(-0.11%) 등... ",http://www.seoulwire.com/news/articleView.html?idxno=639258
sk하이닉스,2025-02-20,"이준석 “반도체산업, 정치권이 나서야”… 이천 <b>SK하이닉스</b> 방문",개혁신당 이준석(화성을) 의원이 20일 <b>SK하이닉스</b> 이천공장을 방문해 관계자들과 반도체 산업에 대한 정부 협력 방안을 논의했다. /이준석 의원실 제공 개혁신당 이준석(화성을) 의원이 20일 <b>SK하이닉스</b> 이천공장을 방문해... ,https://www.kyeongin.com/article/1730047
sk하이닉스,2025-02-20,"한화세미텍, 김동선 부사장 미래비전총괄로 합류...반도체 제조 시장 판...",엔비디아 젠슨 황 CEO는 <b>SK하이닉스</b>와 삼성전자 등에 더욱 혁신적인 고성능 HBM의 빠른 개발을 촉구하는 것으로 전해진다. 이처럼 삼성전자와 <b>SK하이닉스</b>가 제조하는 HBM의 수요가 늘면서 향후 TC본더의 매출도... ,http://www.lkp.news/news/articleView.html?idxno=60576
sk하이닉스,2025-02-20,"(마감시황) 코스피, 8거래일 만에 반락…2,650선 후퇴","<b>SK하이닉스</b> 2.97%↓…대형주 대거 '약세' 한한령 해제 기대감에 화장품·엔터주↑ 코스피는 20일 전장보다 17.46포인트(0.65%) 하락한 2,654.06에 거래를 마쳤다. [사진=연합뉴스] [뉴스투데이=염보라 기자] 20일... ",https://www.news2day.co.kr/article/20250220500197
sk하이닉스,2025-02-20,[마감시황] 코스피 하락..'한한령 해제' 기대에 화장품·엔터주만 급등,"<b>SK하이닉스</b>(-2.97%), 삼성전자(-0.52%), 삼성바이오로직스(-0.61%), 현대차(-0.49%), 기아(-0.53%), 셀트리온(-0.11%), 삼성전자우(0.91%), NAVER(-0.23%)는 하락했으며 LG에너지솔루션(2.87%), 삼성전자우(0.30%), KB금융(0.61%) 등은... ",https://www.newspim.com/news/view/20250220000813
반도체,2025-02-20,"ASML 전 CEO, 삼성전자 평택 공장 방문··· &quot;네덜란드 정부와 가교 역할...",평택 <b>반도체</b> 공장을 방문했다. 20일 업계에 따르면 디르크 벨야르츠 네덜란드 경제부 장관을 비롯한... 삼성전자가 이르면 올해부터 들여오기로 한 ASML의 '하이 뉴메리컬어퍼처(High-NA) EUV 노광장비'와 <b>반도체</b>... ,https://www.ajunews.com/view/20250220163749375
반도체,2025-02-20,"인하대, 학습기업 간담회 성황","마케팅 전략 기획, 영업, 소프트웨어 개발, <b>반도체</b> 장비 개발 등 기업 실무에서 즉시 적용할 수 있는 직무를 중심으로 맞춤형 인재 양성을 위한 논의가 이뤄졌다. 학습기업들은 변화하는 산업 환경 속에서 실무형 인재를... ",https://www.incheonilbo.com/news/articleView.html?idxno=1279744
반도체,2025-02-20,[질문들] &quot;심텍 아닌 이오테크닉스 사라&quot;…왜?,&quot;<b>반도체</b> 레이저장비 수요 급증…마킹 시장 글로벌 점유율 60%&quot; ◦방송: [출발! 딜사이트] 질문들 ◦진행... ◇여도은= <b>반도체</b> 얘기해보겠습니다. 두 번째 질문들. 저희 어제는 한미<b>반도체</b>에 대해 얘기했잖아요. 그런데... ,https://news.dealsitetv.com/articles/151229
반도체,2025-02-20,"알파벳, AI 혁신 가속화 속 2025년 성장 본격화","자체 AI <b>반도체</b> TPU(텐서 프로세싱 유닛)를 지속적으로 개선하며, 6세대 TPU는 이전 세대 대비 4배 높은 성능과 3배 빠른 추론 속도를 제공한다. 또한 2023년 Bard(챗봇)와 Duet AI(업무용 AI)를 공개했으며, 2024년에는 Gemini... ",https://www.e-science.co.kr/news/articleView.html?idxno=101991
삼성전자,2025-02-20,"<b>삼성전자</b>, 업그레이드 '비스포크 AI 식기세척기' 신제품 선보인다",사진=<b>삼성전자</b> <b>삼성전자</b>가 더 똑똑해진 AI 기능과 주방공간에 일체감 있게 녹아드는 미니멀한 디자인을 갖춘 2025년형 '비스포크 AI 식기세척기' 신제품을 21일 출시한다. 식기세척기 신제품은 프리미엄 라인인... ,http://www.thefirstmedia.net/news/articleView.html?idxno=164583
반도체,2025-02-20,"여야정협의체, 최상목·우원식·이재명·권영세 4자회담서 추경과 반도...","만나 <b>반도체</b> 특별법안, 연금개혁, 추가경정예산안(추경) 편성 등을 논의한다. 최상목 대통령 권한대행과... &lt;연합뉴스&gt; 국민의힘 쪽은 &quot;민주당이 <b>반도체</b>특별법안과 관련해 주 52시간 근무 적용 제외를 받아들이지 않는 등... ",https://www.businesspost.co.kr/BP?command=article_view&num=384320
반도체,2025-02-20,[AW 2025 참가기업 인터뷰] 발루프코리아 “차세대 자동화 솔루션으로 이...,"특히, 이차전지, 자동차, <b>반도체</b> 산업 고객과의 긴밀한 협력을 통해 변화하는 산업 환경에 선제적으로 대응하며, 더 나은 품질과 서비스를 제공할 것입니다. 앞으로도 발루프는 신뢰받는 파트너로서 한국... ",https://www.hellot.net/news/article.html?no=98141
반도체,2025-02-20,"한화세미텍, 세미콘코리아서 시장 석권 본격 출사표","규모의 <b>반도체</b> 박람회인 세미콘코리아에 나서며 본격적인 시장 공략에 나섰다. 한화세미텍이... 세미콘은 국제<b>반도체</b>장비재료협회(SEMI)가 매년 주최하는 행사로 한국을 포함해 유럽, 인도, 중국, 일본, 대만 등 전... ",https://www.pinpointnews.co.kr/news/articleView.html?idxno=322621
반도체,2025-02-20,트럼프 러브콜에 화답하는 조선사들...&quot;대미 투자 적극 검토&quot;,"도널드 트럼프 미국 대통령이 자동차·<b>반도체</b> 등에 관세부과 방침을 밝히면서 국내 기업들이 대응책 마련을 고심하고 있는 가운데, 한국 조선업계는 오히려 기회를 엿보고 있다. 트럼프 대통령이 당선 전부터 한국... ",https://n.news.naver.com/mnews/article/025/0003422080?sid=101
반도체,2025-02-20,"트럼프 정부에서 AI 원자력에너지 수요 더 커진다, 전력효율 기술 발전...",현재 빅테크 기업들의 인공지능 인프라 투자는 대량의 고성능 <b>반도체</b>를 활용하는 데이터서버를 기반으로 하고 있어 전력 수요 급증을 이끌고 있다. 하지만 향후 <b>반도체</b>의 소모 전력이 크게 줄어드는 방향으로 기술이... ,https://www.businesspost.co.kr/BP?command=article_view&num=384337
삼성전자,2025-02-20,[CES 2025]&lt;4&gt;커뮤니티 시설 안에 XR이 들어온다 [노승완의 공간짓기],"<b>삼성전자</b>와 삼우설계가 공동개발한 FIT 플랫폼도 이번 CES에서 혁신상을 수상했다. 이 제품은 건물을 구성하는 커튼월, 창호 같은 외피에 ICT(정보통신) 인프라, 전용 OS(운영체제)를 하나로 통합하고 건물 중앙의 인프라를... ",https://n.news.naver.com/mnews/article/081/0003519564?sid=103
삼성전자,2025-02-20,"ASML 전 CEO, <b>삼성전자</b> 평택 공장 방문··· &quot;네덜란드 정부와 가교 역할...",아주경제=이효정 기자 hyo@ajunews.com 한국을 방문한 피터 베닝크 전 ASML 최고경영자(CEO)가 네덜란드 경제부 장관 등과 함께 <b>삼성전자</b> 평택 반도체 공장을 방문했다. 20일 업계에 따르면 디르크 벨야르츠 네덜란드... ,https://www.ajunews.com/view/20250220163749375
삼성전자,2025-02-20,"&quot;수요예측도 못하나&quot;…'역대최다' 판매 갤S25, 소비자는 '부글부글'",<b>삼성전자</b>가 출시한 갤럭시S25 시리즈가 역대 최대 사전판매량을 기록하며 흥행한 반면 소비자 불만도 상당한 것으로 나타났다. 이미 한차례 개통기간을 연장했음에도 인기 색상 모델 수급 문제와 통신사 개통 지연... ,https://n.news.naver.com/mnews/article/117/0003915224?sid=105
sk하이닉스,2025-02-20,KT·네카오·하이브 등 한경협 가입...류진 &quot;외연 확장으로 경제 성장 엔...,"또 <b>SK하이닉스</b>, 고려아연, LX, 동국제강, HS효성, 진에어 등 전통 제조업과 함께 하이브(엔터), 오아시스(이커머스), 베올리아산업개발코리아(친환경) 등 다양한 산업으로 회원사를 확장했다. 네이버·카카오는 글로벌... ",https://www.ajunews.com/view/20250220145200210
sk하이닉스,2025-02-20,[2/20(목) 오늘·내일 시황] “8거래일 만에 코스피 하락…상승 흐름 유...,"<b>SK하이닉스</b>(-2.97%)와 삼성전자(-0.85%), 기아(-0.74%), 삼성바이오로직스(-0.61%), 현대차(-0.49%), NAVER(-0.23%), 셀트리온(-0.11%) 등의 하락폭이 컸고 LG에너지솔루션(2.46%), 삼성전자우(0.30%), KB금융(0.61%) 등 일부 종목은... ",https://n.news.naver.com/mnews/article/119/0002925604?sid=101
sk하이닉스,2025-02-20,[K증시 엇갈린 투심] '역대 최장' 34거래일 순매수…증시 떠받치는 연기...,지난해 12월부터 3조원 이상 코스피 순매수 삼성전자·<b>SK하이닉스</b> 등 대형주 위주 사들여 아주경제=장수영 기자 swimming@ajunews.com 서울 중구 하나은행 본점 딜링룸. [사진=연합뉴스] 연기금이 증시를 떠받치고 있다.... ,https://www.ajunews.com/view/20250220154647300
sk하이닉스,2025-02-20,"[국내증시 마감시황] 코스피 8일, 코스닥 6일 만에 하락 마감",코스피 시가총액 상위 종목 삼성전자(005930) -0.51% <b>SK하이닉스</b>(000660) -2.97% LG에너지솔루션(373220) 2.87% 삼성바이오로직스(207940) -0.61% 현대차(005380) -0.49% 셀트리온(068270) -0.11% 기아(000270) -0.53% NAVER(035420)... ,https://www.tokenpost.kr/article-222743
sk하이닉스,2025-02-20,청주대-<b>SK하이닉스</b>-청주시 전시회 개최,"CACA는 청주대, <b>SK하이닉스</b>, 청주시가 협력해 운영하는 문화예술육성지원 사업이다. 이번 전시회는 지난해 CACA에 참여한 청소년 창작 결과물을 선보이는 자리이다. CACA는 여름방학(키움예술캠프)과 겨울방학... ",http://www.veritas-a.com/news/articleView.html?idxno=543078
반도체,2025-02-20,‘AI 국가대표’ 꾸려 세계 수준 LLM 개발 나선다,"국산 AI <b>반도체</b>가 성장할 수 있도록 글로벌 수준의 하드웨어-소프트웨어 기술생태계를 조성하고, 기술개발 성과의 실증과 사업화도 지원한다. 또 인프라 확충에 맞춰 독자적 AI 모델을 개발해 경쟁력 확보에도 나선다.... ",https://www.viva100.com/article/20250220501092
반도체,2025-02-20,"한화세미텍, 세미콘코리아 첫 참가…김동선, 시장 석권 본격 출사표",(사진=한화세미텍) 최근 새로운 사명을 발표한 한화세미텍(Hanwha Semitech)이 국내 대규모 <b>반도체</b> 박람회인... 세미콘은 국제<b>반도체</b>장비재료협회(SEMI)가 매년 주최하며  <b>반도체</b>산업의 현재와 미래를 한눈에 볼 수 있는... ,http://www.efnews.co.kr/news/articleView.html?idxno=118010
반도체,2025-02-20,[속보] 최상목 &quot;52시간 특례 빠지면 <b>반도체</b>특별법 아닌 보통법…해결점...,,https://n.news.naver.com/mnews/article/011/0004452921?sid=100
반도체,2025-02-20,[속보] 최상목 &quot;<b>반도체</b>법 꼭 필요…근로시간 특례 들어가야&quot;,최상목 &quot;<b>반도체</b>법 꼭 필요…근로시간 특례 들어가야&quot;,https://n.news.naver.com/mnews/article/015/0005096935?sid=101
삼성전자,2025-02-20,'1경원' 잠재력 로봇시장…업계 &quot;팀코리아 필요&quot; 민주당 &quot;모든 일할 것&quot;,류 대표는 &quot;한국은 '피지컬 AI(Physical AI·실체적 인공지능)'에서 차세대 먹거리를 찾을 수 있는 마지막 기회를 가지고 있다&quot;며 &quot;한국에는 돈을 주고도 살 수 없는 <b>삼성전자</b>·LG·현대차 공장의 공정 기술과 노동 데이터란... ,https://n.news.naver.com/mnews/article/008/0005156142?sid=100
삼성전자,2025-02-20,"김문수 고용부 장관 &quot;반도체특별법 주52시간 예외, 여야 떠나 통과돼야...",현행 체제에 따르면 <b>삼성전자</b> 등 반도체 기업들은 기존의 '특별연장근로'를 통해 근로시간을 늘릴 수 있다. 김 장관은 &quot;매번 할 때마다 인가 신청을 해서 인가를 받는 과정과 절차가 복잡하고 (연장기간이) 짧기 때문에... ,https://www.newspim.com/news/view/20250220000927
sk하이닉스,2025-02-20,"[이로운체크]트럼프의 '관세 폭탄', 한국 기업의 선택은?","반도체 업계, 삼성·<b>SK하이닉스</b>, 미국 내 생산 기지 확대 삼성전자는 현재 텍사스주 오스틴과 테일러에 반도체 공장을 운영 및 건설 중이다. 당초 2024년 말 가동을 목표로 했던 테일러 공장은 투자 금액이 조정되면서 일정이... ",https://www.eroun.net/news/articleView.html?idxno=53096
sk하이닉스,2025-02-20,원달러 환율 0.6원 내리고 코스피 2650대 마감,"미국 트럼프 행정부가 자동차·반도체 관세를 4월 전에 발표하겠다고 밝힌 가운데 현대차(-0.49%), 기아(-0.53%) 등 자동차주와 삼성전자(-0.51%), <b>SK하이닉스</b>(-2.97%) 등 반도체주가 약세를 보였다. LG에너지솔루션... ",https://www.newsfreezone.co.kr/news/articleView.html?idxno=610219
sk하이닉스,2025-02-20,류진 한경협 회장 연임···네이버 등 신규회원 합류,이밖에도 <b>SK하이닉스</b>·포스코·고려아연·한국투자금융지주·HS효성·진에어 등의 가입도 확정됐다. 이에 따라 올해 회원사는 470여개사로 확대됐다. 한경협은 &quot;보다 폭넓게 경제계의 의견을 수렴하고 미래산업 육성을... ,https://www.sisajournal-e.com/news/articleView.html?idxno=409650
sk하이닉스,2025-02-20,[20일 마감시황] 일주일 열심히 달린 코스피 '숨 고르기'…0.65% 소폭 하...,시가총액 상위 10개 종목 중 ▲LG에너지솔루션(2.87%) ▲삼성전자우(0.30%) ▲KB금융(0.61%)은 상승한 반면 ▲삼성전자(-0.51%) ▲<b>SK하이닉스</b>(-2.97%) ▲삼성바이오로직스(-0.61%) ▲현대차(-0.49%) ▲셀트리온(-0.11%) ▲기아(-0.... ,https://www.newsworks.co.kr/news/articleView.html?idxno=785383
sk하이닉스,2025-02-20,류진 한경협 회장 “한국 벼랑 끝에 있다. 성장엔진 되살리겠다&quot;,"이밖에 <b>SK하이닉스</b>, 포스코, 고려아연, 한국투자금융지주, HS효성, 진에어 등의 가입도 확정됐다. 미국 도널드 트럼프 행정부와 관련한 방미 사절단 파견은 다음 달로 예정돼있다고 류 회장은 전했다. 한편 한경협은 이날... ",https://n.news.naver.com/mnews/article/082/0001312721?sid=101
반도체,2025-02-20,"산업부·기획재정부, 핵심광물 공급망 안정기금 연간 500억 지원…민간...",정부가 전기차·<b>반도체</b> 등 첨단산업 필수 원료로 활용되는 핵심광물의 공급망 안정화를 위해 민간 투자 지원에 나선다. 정부는 18일 산업통상자원부·기획재정부·외교부가 공동으로 '핵심광물 투자 협의회' 출범 회의를... ,http://www.econonews.co.kr/news/articleView.html?idxno=376049
반도체,2025-02-20,"삼성전자, ASML과 협력 확대… 극자외선 첨단 장비 도입 논의","연합뉴스 제공  네덜란드 경제부 장관과 ASML의 전 최고경영자(CEO)가 삼성전자 평택 <b>반도체</b> 공장을... ASML은 전 세계에서 유일하게 극자외선 노광장비를 생산하는 회사로, <b>반도체</b> 산업에서 중요한 역할을 맡고 있다.... ",https://www.pointdaily.co.kr/news/articleView.html?idxno=234394
반도체,2025-02-20,"[천지일보 사설] 이재명 대표 '우클릭', 실천으로 보여줘야",<b>반도체</b> 분야의 주 52시간 예외 적용에 대해 &quot;왜 안 되냐고 하니 할 말이 없더라&quot;며 수용 가능성을 비치더니 막상 국회 입법 과정에선 돌아서 버렸다. '기본 사회' 논의와 '민생회복지원금'도 접을 듯하다가 다시 꺼내 들었다.... ,https://www.newscj.com/news/articleView.html?idxno=3236647
반도체,2025-02-20,[아주TV 뉴스룸] 2025년 2월 20일 주요 뉴스,"트럼프 &quot;車·<b>반도체</b> 등 관세 한 달 내 발표&quot; 트럼프 대통령은 '미국에서 생산하지 않는 기업들은 관세를 내야 한다'며, 이번 조치가 미국 경제에 큰 영향을 미칠 것이라고 강조했습니다. 더 자세한 내용은 아주TV... ",https://www.ajunews.com/view/20250220163448373
삼성전자,2025-02-20,경기 침체에도…대기업 광고 계열사 '실적 잔치',"<b>삼성전자</b>, 현대자동차 등 대기업 계열 광고 대행사들이 지난해 사상 최대 실적을 거둔 것으로 나타났다. 모기업이 최근 어려움을 겪고 있지만 광고 대행사들은 모기업의 안정적인 일감을 기반으로 성장세를... ",https://n.news.naver.com/mnews/article/015/0005096974?sid=101
삼성전자,2025-02-20,"<b>삼성전자</b>, ASML과 협력 확대… 극자외선 첨단 장비 도입 논의",<b>삼성전자</b> 평택캠퍼스 전경. 연합뉴스 제공  네덜란드 경제부 장관과 ASML의 전 최고경영자(CEO)가 <b>삼성전자</b> 평택 반도체 공장을 찾았다. 업계 관계자는 &quot;<b>삼성전자</b>가 반입할 예정인 ASML의 첨단 장비인 '하이... ,https://www.pointdaily.co.kr/news/articleView.html?idxno=234394
sk하이닉스,2025-02-20,미 '관세 폭탄' 현실화에 충북 산업계도 비상등,"청주시 생산 공장을 둔 <b>SK하이닉스</b> 등이 국내 반도체 산업을 견인하고 있기 때문이다. 20일 업계에 따르면 트럼프 대통령은 19일(현지시간) &quot;다음 한 달 안에 자동차, 반도체, 의약품, 목재 등에 대해 관세를 발표할 것... ",https://www.ccdailynews.com/news/articleView.html?idxno=2326286
sk하이닉스,2025-02-20,증시 부양 나선 연기금…하락 베팅한 개미들 어쩌나?,"같은 날 연기금이 가장 많이 사들인 종목은 삼성전자, <b>SK하이닉스</b>, 삼성바이오로직스, LG에너지솔루션, 에코프로비엠 등 대형 성장주다. 반면 개인 투자자들은 같은 기간 코스피가 하락할 것이라고 예상하고... ",https://n.news.naver.com/mnews/article/008/0005156175?sid=101
sk하이닉스,2025-02-20,"&quot;강세장 3월부터&quot;...질주하는 코스피, 상승세 기대",<b>SK하이닉스</b>(23.83%)와 한미반도체(23.88%)도 같은 영향에 지난 '딥시크 사태' 이후 주춤했던 주가 부진에 반전을 만들어냈다. 다만 엔비디아의 오는 26일(현지시간) 실적발표가 향후 글로벌 반도체 업계를 포함해 국내... ,http://www.finomy.com/news/articleView.html?idxno=223067
sk하이닉스,2025-02-20,"트럼프 관세 폭탄, '韓 메모리 반도체' 피해 가장 크다… 대안 고심","삼성전자와 <b>SK하이닉스</b>는 한국과 중국에서 D램, 낸드플래시를 생산해 미국에 수출하고 있어 관세 회피가 사실상 불가능하다. 특히 메모리는 대량 생산 방식으로 가격 경쟁력이 핵심인데, 25% 관세가 추가되면 미국 내... ",https://www.thepublic.kr/news/articleView.html?idxno=251418
sk하이닉스,2025-02-20,코스피 2650대 하락 마감… 연속 상승 7거래일로 끝,"시가총액 1·2위이자 반도체주인 삼성전자(-0.51%)와 <b>SK하이닉스</b>(-2.97%) 등의 상위권 종목이 하락했다. 운송장·비부품(-2.7%), 보험(-2.6%), 기계·장비(-2.3%), 일반서비스(-2.3%) 등 업종 전반의 약세도 두드러졌다.... ",https://www.dnews.co.kr/uhtml/view.jsp?idxno=202502201638518960414
반도체,2025-02-20,"<b>반도체</b>·조선주 약세...코스피, 8거래일 만에 '하락마감'",20일 <b>반도체</b>와 조선주 등이 약세를 나타내며 코스피가 8거래일 만에 하락마감했다. 이날 코스피는... 요인이었다”며 “<b>반도체</b>는 숨고르기를 보였고 조선주도 다수 종목 약세가 지수 하락을... ,https://www.betanews.net/article/view/beta202502200088
반도체,2025-02-20,"최 권한대행 &quot;세계 최고 AI모델 개발, 스타트업 육성·시장 창출 지원&quot;","AI 밸류체인 전반에 세제지원을 강화하고 전력·입지 관련 제도 개선 등으로 AI 데이터센터에 대한 민간투자를 활성화하는 한편, 국가 AI컴퓨팅 센터를 통해 국산 AI<b>반도체</b>와 AI 모델을 패키지로 실증하고, AI<b>반도체</b> HW... ",https://www.gukjenews.com/news/articleView.html?idxno=3207195
반도체,2025-02-20,GPU 1.8만장 투입…'세계 최고 AI' 개발하겠다는 정부,이미 글로벌 빅테크들이 AI <b>반도체</b> 수십만 장의 ‘규모의 경쟁’을 벌이는 상황에서 한국도 AI 추가경정예산 등 재원 확보를 통한 실질적 지원이 시급하다는 점에서다. ★관련 기사 4면 정부는 20일 최상목 대통령... ,https://n.news.naver.com/mnews/article/011/0004452966?sid=105
삼성전자,2025-02-20,美증시로 떠났던 개미들이 돌아온다,"신용거래융자잔액은 지난 6일부터 9거래일 연속 증가세로, <b>삼성전자</b>를 향한 빚투가 뜨거웠던 지난해 11월 수준까지 확대됐다. 코스콤 체크에 따르면 이달 들어 결제일 기준 지난 19일까지 유가증권시장에서는... ",https://n.news.naver.com/mnews/article/009/0005447243?sid=101
삼성전자,2025-02-20,"<b>삼성</b>SDS, 신임 클라우드사업부장에 이호준 부사장","황성우 대표가 물러나고, <b>삼성전자</b> 무선·네트워크 사업부 출신의 이준희 대표가 신임 CEO로 선임됐다. 삼성SDS는 이번 인사를 통해 클라우드 사업을 강화하고, 디지털 전환 시장에서 경쟁력을 더욱 키워나겠다는... ",https://www.ajunews.com/view/20250220153300279
삼성전자,2025-02-20,국회 환노위서 野 “반도체 특별법 야당 탓 돌리지 마라”,"박홍배 민주당 의원은 <b>삼성전자</b>의 최근 부진 원인에 대해 “<b>삼성전자</b>의 후진적 기업 문화와 인재 관리가 실패했기 때문”이라며 “(이런 문제가 있는데) 법의 핵심을 비켜나가서 노동시간 문제 때문이라고, 야당... ",https://n.news.naver.com/mnews/article/023/0003889256?sid=102
삼성전자,2025-02-20,8년 '족쇄' 풀리나...지수 하락에도 '불기둥' [박해린의 마켓톡톡],"여기에 <b>삼성전자</b> 지분 추가 매각 계획이 없다는 점, 밸류업 관련 계획이 구체적이지 않았다는 점도 주가를 끌어내린 것으로 풀이됩니다. 다만 실망은 이르다는 시각도 제기됩니다. 삼성생명 측이 구체적인 주주환원... ",https://n.news.naver.com/mnews/article/215/0001199268?sid=101
